{
  "$schema": "../schemas/building_art.schema.json",
  "materials": {
    "earth": {
      "lit": "#8b7554",
      "mid": "#6b5a41",
      "shadow": "#403528",
      "ink": 0.32,
      "grain": 0.85,
      "edge": 0.55
    },
    "turf": {
      "lit": "#8a9455",
      "mid": "#6f7a44",
      "shadow": "#414a27",
      "ink": 0.3,
      "grain": 0.8,
      "edge": 0.5
    },
    "timber": {
      "lit": "#9a7448",
      "mid": "#7a5a36",
      "shadow": "#4a361f",
      "ink": 0.45,
      "grain": 0.9,
      "edge": 0.7
    },
    "wattle": {
      "lit": "#a99070",
      "mid": "#8a7550",
      "shadow": "#564630",
      "ink": 0.4,
      "grain": 1.0,
      "edge": 0.55
    },
    "thatch": {
      "lit": "#c8a664",
      "mid": "#a8894f",
      "shadow": "#6b562e",
      "ink": 0.35,
      "grain": 1.0,
      "edge": 0.45
    },
    "mudbrick": {
      "lit": "#c6a279",
      "mid": "#a9865c",
      "shadow": "#6d5336",
      "ink": 0.42,
      "grain": 0.65,
      "edge": 0.7
    },
    "stucco": {
      "lit": "#ead9b6",
      "mid": "#d8c7a4",
      "shadow": "#96866a",
      "ink": 0.5,
      "grain": 0.3,
      "edge": 0.85
    },
    "rubble": {
      "lit": "#a49c8e",
      "mid": "#8a8377",
      "shadow": "#544f47",
      "ink": 0.46,
      "grain": 0.75,
      "edge": 0.75
    },
    "ashlar": {
      "lit": "#cdc5b0",
      "mid": "#b5ad9a",
      "shadow": "#7a7364",
      "ink": 0.6,
      "grain": 0.35,
      "edge": 1.0
    },
    "marble": {
      "lit": "#f6efdc",
      "mid": "#ede3c7",
      "shadow": "#b8ab8c",
      "ink": 0.72,
      "grain": 0.1,
      "edge": 1.0
    },
    "sandstone": {
      "lit": "#dcbc86",
      "mid": "#c3a068",
      "shadow": "#7f6742",
      "ink": 0.52,
      "grain": 0.45,
      "edge": 0.9
    },
    "granite": {
      "lit": "#a8a29a",
      "mid": "#8c8781",
      "shadow": "#55514d",
      "ink": 0.62,
      "grain": 0.4,
      "edge": 1.0
    },
    "terracotta": {
      "lit": "#c66c40",
      "mid": "#a8542f",
      "shadow": "#66311b",
      "ink": 0.48,
      "grain": 0.55,
      "edge": 0.85
    },
    "bronze": {
      "lit": "#ab8646",
      "mid": "#8a6a34",
      "shadow": "#4f3d1e",
      "ink": 0.55,
      "grain": 0.25,
      "edge": 0.95
    },
    "gilt": {
      "lit": "#f0cd6e",
      "mid": "#c9a247",
      "shadow": "#8a6c26",
      "ink": 0.5,
      "grain": 0.15,
      "edge": 1.0,
      "tint": 0.15
    },
    "iron": {
      "lit": "#7b8087",
      "mid": "#5b5f64",
      "shadow": "#32353a",
      "ink": 0.58,
      "grain": 0.3,
      "edge": 0.95
    },
    "cloth": {
      "lit": "#e2d8bd",
      "mid": "#c9bda0",
      "shadow": "#8a8069",
      "ink": 0.4,
      "grain": 0.2,
      "edge": 0.6,
      "tint": 0.85
    },
    "water": {
      "lit": "#3f7392",
      "mid": "#2d5673",
      "shadow": "#1c3648",
      "ink": 0.25,
      "grain": 0.15,
      "edge": 0.3
    },
    "homespun": {
      "lit": "#b9ad93",
      "mid": "#9a8f78",
      "shadow": "#5f5849",
      "ink": 0.42,
      "grain": 0.3,
      "edge": 0.6,
      "tint": 0.18
    }
  },
  "tracks": {
    "roman": [
      "timber",
      "timber",
      "ashlar",
      "ashlar",
      "marble",
      "marble"
    ],
    "greek": [
      "timber",
      "mudbrick",
      "ashlar",
      "marble",
      "marble",
      "marble"
    ],
    "eastern": [
      "mudbrick",
      "mudbrick",
      "mudbrick",
      "sandstone",
      "sandstone",
      "granite"
    ],
    "carthaginian": [
      "timber",
      "mudbrick",
      "stucco",
      "ashlar",
      "ashlar",
      "ashlar"
    ],
    "egyptian": [
      "mudbrick",
      "mudbrick",
      "sandstone",
      "sandstone",
      "granite",
      "granite"
    ],
    "barbarian": [
      "timber",
      "timber",
      "timber",
      "timber",
      "timber",
      "timber"
    ],
    "neutral": [
      "timber",
      "rubble",
      "rubble",
      "ashlar",
      "ashlar",
      "ashlar"
    ]
  },
  "fragments": {
    "portico": {
      "params": {
        "columns": 4,
        "order": "tuscan",
        "roof": "tiled",
        "roof_mat": "terracotta",
        "akroteria": 0,
        "tympanum": "none"
      },
      "parts": [
        {
          "part": "column_row",
          "at": [
            0.5,
            0.88
          ],
          "size": [
            0.92,
            0.6
          ],
          "p": {
            "columns": "$columns",
            "order": "$order",
            "spacing": 1.9
          }
        },
        {
          "part": "entablature",
          "at": [
            0.5,
            0.28
          ],
          "size": [
            1.0,
            0.11
          ],
          "p": {
            "cornice": true,
            "order": "$order"
          }
        },
        {
          "part": "roof",
          "at": [
            0.5,
            0.19
          ],
          "size": [
            0.96,
            0.1
          ],
          "mat": "$roof_mat",
          "layer": "back",
          "p": {
            "style": "$roof",
            "pitch": 0.34,
            "ribs": 9
          }
        },
        {
          "part": "pediment",
          "at": [
            0.5,
            0.17
          ],
          "size": [
            1.04,
            0.17
          ],
          "p": {
            "akroteria": "$akroteria",
            "tympanum": "$tympanum"
          }
        }
      ]
    },
    "colonnade_wing": {
      "params": {
        "columns": 6,
        "order": "tuscan",
        "roof": "tiled",
        "roof_mat": "terracotta"
      },
      "parts": [
        {
          "part": "column_row",
          "at": [
            0.5,
            0.9
          ],
          "size": [
            0.94,
            0.66
          ],
          "p": {
            "columns": "$columns",
            "order": "$order",
            "spacing": 1.7
          }
        },
        {
          "part": "entablature",
          "at": [
            0.5,
            0.24
          ],
          "size": [
            1.0,
            0.1
          ],
          "p": {
            "cornice": true,
            "order": "$order"
          }
        },
        {
          "part": "roof",
          "at": [
            0.5,
            0.15
          ],
          "size": [
            1.02,
            0.11
          ],
          "mat": "$roof_mat",
          "layer": "back",
          "p": {
            "style": "$roof",
            "pitch": 0.3,
            "ribs": 8
          }
        }
      ]
    }
  },
  "cults": {
    "law": {
      "from_tier": 2,
      "add": [
        {
          "name": "cult_law",
          "part": "stele",
          "at": [
            0.26,
            0.86
          ],
          "size": [
            0.05,
            0.13
          ],
          "mat": "$track",
          "p": {
            "lines": 5
          }
        }
      ]
    },
    "battle": {
      "from_tier": 2,
      "add": [
        {
          "name": "cult_battle",
          "part": "trophy",
          "at": [
            0.26,
            0.86
          ],
          "size": [
            0.09,
            0.17
          ],
          "mat": "iron",
          "p": {
            "shield": "scutum",
            "helmet": "crest"
          }
        }
      ]
    },
    "fertility": {
      "from_tier": 1,
      "add": [
        {
          "name": "cult_fert",
          "part": "beasts",
          "at": [
            0.8,
            0.89
          ],
          "size": [
            0.16,
            0.09
          ],
          "mat": "earth",
          "layer": "front",
          "p": {
            "kind": "ox",
            "count": 1
          }
        },
        {
          "name": "cult_jars",
          "part": "vessels",
          "at": [
            0.24,
            0.88
          ],
          "size": [
            0.1,
            0.08
          ],
          "mat": "terracotta",
          "p": {
            "count": 3,
            "kind": "grain"
          }
        }
      ]
    },
    "fun": {
      "from_tier": 2,
      "add": [
        {
          "name": "cult_fun",
          "part": "awning",
          "at": [
            0.22,
            0.86
          ],
          "size": [
            0.2,
            0.1
          ],
          "mat": "cloth",
          "p": {
            "scallops": 5,
            "poles": 2
          }
        }
      ]
    },
    "trade": {
      "from_tier": 1,
      "add": [
        {
          "name": "cult_trade",
          "part": "vessels",
          "at": [
            0.24,
            0.88
          ],
          "size": [
            0.13,
            0.1
          ],
          "mat": "terracotta",
          "p": {
            "count": 5,
            "kind": "amphora"
          }
        }
      ]
    },
    "forge": {
      "from_tier": 1,
      "add": [
        {
          "name": "cult_forge",
          "part": "forge",
          "at": [
            0.22,
            0.87
          ],
          "size": [
            0.16,
            0.14
          ],
          "mat": "$track",
          "p": {
            "chimney": 0.5,
            "smoke": 3,
            "glow": true
          }
        }
      ]
    },
    "healing": {
      "from_tier": 2,
      "add": [
        {
          "name": "cult_heal",
          "part": "well",
          "at": [
            0.24,
            0.88
          ],
          "size": [
            0.12,
            0.09
          ],
          "mat": "ashlar",
          "p": {
            "style": "well",
            "frame": true
          }
        }
      ]
    },
    "naval": {
      "from_tier": 2,
      "add": [
        {
          "name": "cult_naval",
          "part": "hull",
          "at": [
            0.8,
            0.9
          ],
          "size": [
            0.24,
            0.09
          ],
          "mat": "timber",
          "layer": "front",
          "p": {
            "oars": 7,